{
  "escalation": [
    "checkin_flag",
    "stop",
    "new_experiment_required",
    "decision_block"
  ],
  "family": "specialist-review",
  "id": "higgs-theory-uncertainty-auditor",
  "independence": {
    "kind": "specialist",
    "distinct_actor_from": [
      "coordinator",
      "higgs-coupling-analyst",
      "extended-scalar-modeler"
    ],
    "fresh_session": true
  },
  "kind": "role-card",
  "knowledge": {
    "budget_tokens": 24000,
    "consult": [],
    "derive": [
      "handbooks_for_node",
      "checks_judging_node",
      "premises_firing",
      "conventions:node_tags"
    ],
    "forbidden": [
      "lessons",
      "other_verdicts",
      "producer_headline",
      "withheld_sources"
    ],
    "may_query": [
      "find",
      "show",
      "for_node",
      "coverage"
    ],
    "must_read": [
      "conv:higgs-theory-uncertainty"
    ]
  },
  "model": {
    "distinct_family_from": [],
    "effort": "high",
    "tier": "judgment"
  },
  "must_check": [
    "check:higgs.theory_correlation"
  ],
  "operations": [
    "knowledge query",
    "review-context read",
    "check run"
  ],
  "output": {
    "declared_outputs": [],
    "schema": "findings.v1",
    "sidecar": true
  },
  "protocol": [
    "Audit shared signal theory nuisances across experiments, scale and PDF definitions, and duplicated uncertainty sources.",
    "Record framework, loop-coupling definitions, width assumptions, mass reference, supplied dataset release and every parameter or population source before using a prediction.",
    "Inspect inclusive, STXS and differential sample overlap. Require a supplied joint likelihood for reused events and keep asymmetric likelihoods near physical boundaries.",
    "Inspect shared signal theory sources and correlations; use consistent scale and PDF definitions and count each table or program uncertainty once.",
    "Preserve supplied angle ranges, cosine signs, Yukawa types and wrong-sign branches, and require an explicit basis transport before comparing tan(beta).",
    "Declare the requested statistic and its scope. An expected-sensitivity channel selection is not a channel combination; a confidence-region dimension is not a goodness-of-fit residual dimension.",
    "Acquire the framework and tool handbooks through the governed resource route. A missing handbook or operation check remains an unresolved obligation; no metadata check grants physics qualification.",
    "Run the card-named checks through check run on a source-bound supplied JSON document. An inconclusive operation delegation is not a pass. Native or remote work uses method admission and the existing launch guard.",
    "Give every finding an evidence class (new_receipt, code_check, cited or opinion) and the receipt, check or locator IDs behind it. Only new_receipt, code_check or a typed discriminating-test request can block; cited claims and opinions stay advisory. Ask for the cheapest discriminating test that could invalidate the claim.",
    "Report public rationales and located evidence. Never accept your own work, widen approval or erase an unresolved obligation."
  ],
  "purpose": "Audit shared signal theory nuisances across experiments, scale and PDF definitions, and duplicated uncertainty sources.",
  "requires": {
    "attestation_min": "transport",
    "blind": true,
    "isolation_min": "ravel-sandbox",
    "structured_output": true,
    "tools": "broker-readonly"
  },
  "reviewed_by": [],
  "schema_version": 2,
  "sees": {
    "profile": "blind",
    "forbidden_inputs": [
      "lessons",
      "other_verdicts",
      "producer_headline",
      "withheld_sources"
    ]
  },
  "stop": {
    "evidence_budget": 0,
    "max_broker_calls": 200,
    "max_cost_usd": null,
    "max_rounds": 2,
    "max_turns": 40,
    "max_wall_seconds": 1200
  },
  "tools": {
    "exec_argv_prefixes": [],
    "ravel_actions": [
      "knowledge query",
      "review-context read",
      "check run"
    ],
    "read_paths": [
      "inputs/"
    ],
    "validators": [
      "check:higgs.theory_correlation"
    ]
  },
  "version": "1.0.0"
}
