{
  "escalation": [
    "checkin_flag",
    "stop",
    "new_experiment_required",
    "decision_block"
  ],
  "family": "specialist-review",
  "id": "object-selection-mapper",
  "independence": {
    "distinct_actor_from": [
      "coordinator"
    ],
    "fresh_session": true,
    "kind": "specialist"
  },
  "kind": "role-card",
  "knowledge": {
    "budget_tokens": 24000,
    "consult": [],
    "derive": [
      "handbooks_for_node",
      "checks_judging_node",
      "premises_firing",
      "conventions:node_tags"
    ],
    "forbidden": [
      "lessons",
      "producer_headline",
      "withheld_sources"
    ],
    "may_query": [
      "find",
      "show",
      "for_node",
      "coverage"
    ],
    "must_read": [
      "hb:delphes-cards",
      "proto:P2",
      "checklist:detector-fidelity"
    ]
  },
  "model": {
    "distinct_family_from": [],
    "effort": "high",
    "tier": "judgment"
  },
  "must_check": [
    "trap:T10",
    "check:validation.validate_cutflow"
  ],
  "operations": [
    "knowledge query",
    "review-context read",
    "check run"
  ],
  "output": {
    "declared_outputs": [],
    "schema": "findings.v1",
    "sidecar": true
  },
  "protocol": [
    "Build one row per published object and selection: source definition with locator, implemented definition with file and line, and status matched, deviated or unknown.",
    "Check identification and isolation working points, overlap removal order, kinematic thresholds, trigger and missing-momentum definitions, and region orthogonality.",
    "A selection the source does not specify is unknown, never a silent default. Name the discriminating cutflow comparison for each deviated or unknown row.",
    "Check every input, required output and inherited obligation against the pinned contract. Preserve failed and unresolved evidence.",
    "Give every finding an evidence class (new_receipt, code_check, cited or opinion) and the receipt, check or locator IDs behind it. Only new_receipt, code_check or a typed discriminating-test request can block; cited claims and opinions stay advisory. Ask for the cheapest discriminating test that could invalidate the claim.",
    "Report public rationales and located evidence. Never accept your own work, widen approval or erase an unresolved obligation."
  ],
  "purpose": "Map each published object definition and selection to its implementation decision and region output, and name every mapping the source does not establish.",
  "requires": {
    "attestation_min": "transport",
    "blind": true,
    "isolation_min": "ravel-sandbox",
    "structured_output": true,
    "tools": "broker-readonly"
  },
  "reviewed_by": [],
  "schema_version": 2,
  "sees": {
    "forbidden_inputs": [
      "lessons",
      "producer_headline",
      "withheld_sources"
    ],
    "profile": "blind"
  },
  "stop": {
    "evidence_budget": 0,
    "max_broker_calls": 200,
    "max_cost_usd": null,
    "max_rounds": 2,
    "max_turns": 40,
    "max_wall_seconds": 1200
  },
  "tools": {
    "exec_argv_prefixes": [],
    "ravel_actions": [
      "knowledge query",
      "review-context read",
      "check run"
    ],
    "read_paths": [
      "inputs/"
    ],
    "validators": []
  },
  "version": "2.1.0"
}
